<?xml version="1.0" encoding="UTF-8"?>
<?xml-stylesheet type='text/xsl' href='/xml/xsd2html2xml/xsd2html2xml.xsl'?>

<recipe 
xmlns="https://cazzscookingcommunity.github.io" 
xmlns:xsi="http://www.w3.org/2001/XMLSchema-instance" 
xsi:schemaLocation="https://cazzscookingcommunity.github.io /xml/recipe.xsd"> 
                                                                                
    <title>Easy Stir Fry</title>

    <comment></comment>
    <thumbnail>../images/placeholder.png</thumbnail>
    <image></image>
    <category></category>
    <yield></yield>
    <prepTime></prepTime>
    <cookTime></cookTime>
    



    <ingredient>2 chicken breast diced</ingredient>
    <ingredient>2-3 garlic cloves crushed </ingredient>
    <ingredient>3 TBsp oil</ingredient>
    <ingredient>1 stock cube</ingredient>
    <ingredient>1/3 cup stir fry sauce </ingredient>
    <ingredient>1 bag frozen stir fry vegetables </ingredient>
    <ingredient>1 packet pad Thai noodles</ingredient>

    <step>
Cook noodles per packet directions and set aside. Heat oil in wok or large pan. Cook garlic until fragrant then add chicken and cook in batches and remove from pan.  Cook vegetables in pan then add chicken back to pan, along with noodles and sauce. Add salt and pepper if desired and garnish with a couple of chopped spring onions. Serve immediately and place any remaining in fridge, for up till three days.
    </step>
</recipe>