<?xml version="1.0" encoding="UTF-8"?>
<?xml-stylesheet type='text/xsl' href='/xml/xsd2html2xml/xsd2html2xml.xsl'?>

<recipe 
xmlns="https://cazzscookingcommunity.github.io" 
xmlns:xsi="http://www.w3.org/2001/XMLSchema-instance" 
xsi:schemaLocation="https://cazzscookingcommunity.github.io /xml/recipe.xsd"> 
                                                                                
    <title>Sarah Os Brownies</title>
    <filename>sarah_os_brownies.xml</filename>

    <comment></comment>
    <thumbnail>../images/placeholder.png</thumbnail>
    <image></image>
    <category></category>
    <yield></yield>
    <prepTime></prepTime>
    <cookTime></cookTime>
    



    <ingredient>200gms milk chocolate (broken into small pieces)</ingredient>
    <ingredient>170 gms butter</ingredient>
    <ingredient>1 1/4 cups brown sugar</ingredient>
    <ingredient>3 eggs beaten</ingredient>
    <ingredient>1/2 cup + 1 TBsp flour sifted </ingredient>
    <ingredient>1/3 cup cocoa powder sifted</ingredient>
    <ingredient>3/4 cup white chic chips</ingredient>
    <ingredient>1 cup frozen raspberries (if desired.)</ingredient>

    <step>
Preheat oven to 180D. Grease baking tray and line with baking paper then set aside. Melt butter first then add chocolate and stir until melted. Add sugar and stir until dissolved. Leave to cool for 5 minutes. Add half eggs and half the combined cocoa and flour, then stir well. Add remaining egg and flour mix and stir until completely combined. Stir through chocolate chips and raspberries if using, then pour into prepared tray. Sprinkle top with extra chic chips if desired. Cook for 40 minutes and turn half way through. Once cool cut into slices.
    </step>
</recipe>