<?xml version="1.0" encoding="UTF-8"?>
<?xml-stylesheet type='text/xsl' href='/xml/xsd2html2xml/xsd2html2xml.xsl'?>

<recipe
    xmlns="https://cazzscookingcommunity.github.io"
    xmlns:xsi="http://www.w3.org/2001/XMLSchema-instance" 
    xsi:schemaLocation="https://cazzscookingcommunity.github.io ../../xml/recipe.xsd"> 
    
<title>Lemon Slice</title>
<filename>lemon_slice.xml</filename>
<thumbnail>lemon_slice.jpeg</thumbnail>
<category>Snack</category>
<category>Dessert</category>
<diet>Vegetarian</diet>
<yield>12</yield>
<prepTime>PT15M</prepTime>
<cookTime>PT4H</cookTime>
<part><title>Base</title>
<ingredient>1 Packet Marie biscuits crushed</ingredient>
<ingredient>1 cup coconut </ingredient>
<ingredient>1 lemon grind grated</ingredient>
<ingredient>125 gms butter</ingredient>
<ingredient>1/2 can condensed milk</ingredient>
<step>Grease a baking dish about 19x28 cm with butter and put a sheet of grease proof paper on top, then set aside.</step>
<step>Crushed biscuits, coconut and lemon grind in a large bowl and stir to cook combine.</step>
<step>Melt butter on stove top in a small saucepan and once all melted add condensed milk.</step>
<step>Stir well and add to biscuits.</step>
<step>Mix all together with a spoon and pour in prepared dish.</step>
<step>Flatten with your hand or the back of the spoon to make it as smooth as possible.</step>
<step>Place in fridge while you prepare icing.</step>
</part>
<part><title>Icing:</title>
<ingredient>1 1-2 cups icing sugar</ingredient>
<ingredient>1 TBsp butter melted</ingredient>
<ingredient>2 TBsp lemon juice</ingredient>
<ingredient>Extra coconut</ingredient>
<step>Sift icing sugar into a bowl and pour in lemon juice and melted butter.</step>
<step>Stir well to remove all the lumps.</step>
<step>You may need to add a little hot water (1 TBsp) if it seems too dry.</step>
<step>Pour on top of base and smooth out evenly.</step>
<step>Sprinkle with extra coconut if desired.</step>
<step>Cover and refrigerate for 4 hours or until icing set.</step>
<step>Cut into bite size pieces.</step>
<step>Stored in an airtight container.</step>
</part>
</recipe>

