<?xml version='1.0' encoding='UTF-8'?>
<recipe xmlns="https://cazzscookingcommunity.github.io" xmlns:xsi="http://www.w3.org/2001/XMLSchema-instance" xsi:schemaLocation="https://cazzscookingcommunity.github.io /xml/recipe.xsd">
  <title>Lemon Shortbread </title>
  <filename>lemon_shortbread.xml</filename>
  <comment>c/o irenamacri.com with cazzie tweaks </comment>
  <thumbnail>../images/lemon_shrotbread.jpeg</thumbnail>
  <category>Sweets</category>
  <diet>LowCarb</diet>
  <diet>GlutenFree</diet>
  <ingredient>1 cup Gluten Free flour</ingredient>
  <ingredient>1/3 cup coconut flour </ingredient>
  <ingredient>1/2 cup coconut sugar</ingredient>
  <ingredient>1/2 teaspoon baking powder </ingredient>
  <ingredient>1 egg</ingredient>
  <ingredient>150 gms butter melted </ingredient>
  <ingredient>Zest of one lemon</ingredient>
  <ingredient>2 teaspoon vanilla essence </ingredient>
  <step>Preheat oven to 160C.</step>
  <step>Prepare two trays and line with baking sheet and set aside.</step>
  <step>In a bowl place gluten free flour, coconut flour, coconut sugar, baking powder and lemon zest.</step>
  <step>Stir well with a whisk, then pour in melted butter and stir with a wooden spoon.</step>
  <step>In a separate bowl whisk egg and vanilla essence.</step>
  <step>Pour into mixture and stir with wooden spoon until completely mixed.</step>
  <step>Scoop out heap tablespoon amounts and roll into balls and place evenly spreading them apart covering the trays.</step>
  <step>Push down balls of dough slightly with the back of a fork.</step>
  <step>Place in oven for 10 - 15 minutes or until golden brown.</step>
  <step>Cool completely and store in airtight container.</step>
  <step>Great with a cuppa!.</step>
</recipe>
