<?xml version='1.0' encoding='UTF-8'?>
<?xml-stylesheet type='text/xsl' href='/xml/xsd2html2xml/xsd2html2xml.xsl'?>
<recipe xmlns="https://cazzscookingcommunity.github.io"
        xmlns:xsi="http://www.w3.org/2001/XMLSchema-instance"
        xsi:schemaLocation="https://cazzscookingcommunity.github.io ../../xml/recipe.xsd">
  <title>Acquacotta</title>
  <filename>acquacotta.xml</filename>
  <thumbnail>acquacotta.jpeg</thumbnail>
  <category>Soup</category>
  <diet>Vegetarian</diet>
  <yield>4</yield>
  <prepTime>PT15M</prepTime>
  <cookTime>PT1H15M</cookTime>
  <ingredient>2-3 Tbsp olive oil</ingredient>
  <ingredient>2-3 garlic cloves crushed</ingredient>
  <ingredient>Pinch of chili</ingredient>
  <ingredient>2-4 celery stalks chopped</ingredient>
  <ingredient>1-2 carrots chopped</ingredient>
  <ingredient>1 cup white wine</ingredient>
  <ingredient>6 cups water</ingredient>
  <ingredient>2 stock cubes</ingredient>
  <ingredient>2 cans chopped tomatoes</ingredient>
  <ingredient>salt and pepper to taste</ingredient>
  <ingredient>1 cup ricotta cheese (optional)</ingredient>
  <ingredient>4 eggs (optional)</ingredient>
  <ingredient>4 slices stale bread (optional)</ingredient>
  <ingredient>Any Italian herbs (parsley or basil) you have on hand (optional)</ingredient>
  <step>Heat oil in large pot and cook garlic on low for 5 minutes.</step>
  <step>Add carrots and celery and cook for a further 5 minutes.</step>
  <step>Sprinkle in chili and stir well, then add water, stock cubes, tomatoes, wine, and salt and pepper.</step>
  <step>Bring to boil then reduce to a simmer and cook for 1 hour.</step>
  
</recipe>
