<?xml version="1.0" encoding="UTF-8"?>
<?xml-stylesheet type='text/xsl' href='/xml/xsd2html2xml/xsd2html2xml.xsl'?>

<recipe
    xmlns="https://cazzscookingcommunity.github.io"
    xmlns:xsi="http://www.w3.org/2001/XMLSchema-instance" 
    xsi:schemaLocation="https://cazzscookingcommunity.github.io ../../xml/recipe.xsd"> 
    
<title>Larb</title>
<filename>larb.xml</filename>
<thumbnail>larb.jpeg</thumbnail>
<category>Dinner</category>
<category>Lunch</category>
<category>Pork</category>
<diet>FODMAP</diet>
<diet>LowSugar</diet>
<diet>GlutenFree</diet>
<diet>DiaryFree</diet>
<diet>FODMAP</diet>
<diet>LowCarb</diet>
<diet>EggFree</diet>
<yield>6</yield>
<prepTime>PT30M</prepTime>
<cookTime>PT10M</cookTime>
<ingredient>600 gms minced pork </ingredient>
<ingredient>3 Tbsps olive oil </ingredient>
<ingredient>2 garlic cloves crushed</ingredient>
<ingredient>1 inch ginger grated</ingredient>
<ingredient>1/2 teaspoon chilli powder </ingredient>
<ingredient>1-2 limes juiced</ingredient>
<ingredient>1/3 cup fish sauce</ingredient>
<ingredient>1 teaspoon sugar</ingredient>
<ingredient>1/4 cup mint leaves chopped</ingredient>
<ingredient>3 cups rice noodles cooked and chopped</ingredient>
<ingredient>1 lettuce leaves removed</ingredient>
<ingredient>Extra limes to serve</ingredient>
<step>Prepare lettuce leaves and set aside. Google how to easily remove lettuce leaves easily.</step>
<step>Combine lime juice, fish sauce and sugar, stir to combine and set aside.</step>
<step>Heat oil in pan and cook meat until brown.</step>
<step>Add garlic, ginger and chilli and cook a few minutes more.</step>
<step>Pour in juice mixture and stir through with noodles.</step>
<step>Serve inside a lettuce cup with lime on the side.</step>
<step>Alternately serve in rolled lettuce leaves, with thinly sliced cumber, lettuce and some chilli sauce.</step>
</recipe>

