<?xml version='1.0' encoding='UTF-8'?>
<?xml-stylesheet type='text/xsl' href='/xml/xsd2html2xml/xsd2html2xml.xsl'?>
<recipe xmlns="https://cazzscookingcommunity.github.io"
        xmlns:xsi="http://www.w3.org/2001/XMLSchema-instance"
        xsi:schemaLocation="https://cazzscookingcommunity.github.io ../../xml/recipe.xsd">
  <title>Rocky Road</title>
  <filename>rocky_road.xml</filename>
  <thumbnail>rocky_road.jpeg</thumbnail>
  <category>Sweets</category>
  <ingredient>500gms milk chocolate </ingredient>
  <ingredient>200gms dark chocolate </ingredient>
  <ingredient>4 x 55gm bars Turkish Delight</ingredient>
  <ingredient>400gms marshmallows </ingredient>
  <ingredient>1 1/2 cups peanuts chopped </ingredient>
  <ingredient>1 cup coconut </ingredient>
  <ingredient>1 cup rice bubbles</ingredient>
  <step>Spray a 25x15cm tray with oil and push down baking paper to cover tray, then set aside.</step>
  <step>Chop Turkish Delights and set aside.</step>
  <step>Break apart chocolate into small pieces and melt in double pot until all melted.</step>
  <step>Set aside for five minutes.</step>
  <step>Stir in rice bubbles, nuts, coconut and Turkish Delight.</step>
  <step>Then stir through marshmallows and pour into prepared tray.</step>
  <step>Push to sides and smooth over the top a little.</step>
  <step>Cover then put in freezer for 1/2 hour.</step>
  <step>Remove from freezer then chop into bite size pieces.</step>
  <step>Store in airtight container.</step>
</recipe>
