<?xml version='1.0' encoding='UTF-8'?>
<?xml-stylesheet type='text/xsl' href='/xml/xsd2html2xml/xsd2html2xml.xsl'?>
<recipe xmlns="https://cazzscookingcommunity.github.io"
        xmlns:xsi="http://www.w3.org/2001/XMLSchema-instance"
        xsi:schemaLocation="https://cazzscookingcommunity.github.io /xml/recipe.xsd">
  <title>Jasmines Ice Coffee</title>
  <filename>jasmines_ice_coffee.xml</filename>
  <comment/>
  <thumbnail>ice_coffee.jpeg</thumbnail>
  <image/>
  <category/>
  <yield/>
  <prepTime>PT0M</prepTime>
  <cookTime>PT0M</cookTime>
  <ingredient>1/4 cup brewed coffee</ingredient>
  <ingredient>( alternative dissolve 1 teasp instant coffee with 1/4 cup boiling water, then cool)</ingredient>
  <ingredient>1 teasp sugar dissolved in coffee</ingredient>
  <ingredient>Milk </ingredient>
  <ingredient>1 scoop vanilla ice cream </ingredient>
  <ingredient>2-4 ice cubes</ingredient>
  <ingredient>1 teaspoon fresh whipped cream or double cream</ingredient>
  <ingredient>Cocoa</ingredient>
  <step>
In a tall glass pour in coffee. Carefully put in ice cubes, then ice cream into the glass. Pour in enough milk to almost reach the top. Gently scoop the cream on top and sprinkle decoratively with a pinch of cocoa (cocoa can be replaced with chocolate powder), serve with a long spoon!
    </step>
</recipe>
