<?xml version="1.0" encoding="UTF-8"?>
<?xml-stylesheet type='text/xsl' href='/xml/xsd2html2xml/xsd2html2xml.xsl'?>

<recipe 
xmlns="https://cazzscookingcommunity.github.io" 
xmlns:xsi="http://www.w3.org/2001/XMLSchema-instance" 
xsi:schemaLocation="https://cazzscookingcommunity.github.io recipe.xsd"> 
                                                                                
    <title>Roasted Veg and Buckwheat Salad</title>
    <filename>roasted_veg_and_buckwheat_salad.xml</filename>

    <comment>c/o Woolworth with cazzie tweaks </comment>
    <thumbnail>../images/placeholder.png</thumbnail>
    <image></image>
    <category></category>
    <yield></yield>
    <prepTime></prepTime>
    <cookTime></cookTime>

    <diet>GlutenFree</diet>
    <diet>Vegan</diet>

    <part>
        <title>Salad</title>
        <ingredient>400 gms sweet potatoes</ingredient>
        <ingredient>400 gms pumpkin</ingredient>
        <ingredient>300 gms beets (optional)</ingredient>
        <ingredient>1 red capsicum</ingredient>
        <ingredient>1 TBsp rosemary fine chopped</ingredient>
        <ingredient>3 cloves garlic crushed</ingredient>
        <ingredient>1/3 cup olive oil</ingredient>
        <ingredient>1 cup buckwheat</ingredient>
        <ingredient>2 cups stock</ingredient>
        <ingredient>4-6 cups spinach and rockets</ingredient>
        <ingredient>Lemon wedges to serve</ingredient>
        <step>Preheat oven to 200C. Chop veggies into 3-5 cm pieces. Combine veggies, Rosemary, garlic and 1/4 cup olive oil and mix well with your hands. Place in oven for 30-40 minutes (or until cooked and browning slightly.) </step>

        <step>Meanwhile heat remaining oil in pan and add buckwheat. Cook for 4 minutes and stir continuously. Add stock and bring to the boil. Reduce to a simmer, put a lid on pan and cook for 15 minutes or until most of the stock is absorbed. </step>

        <step>Meanwhile make dressing </step>

        <step>To prepare sprinkle spinach and rocket over a platter, then sprinkle 1/2 of the buckwheat on top. Place roasted veggies on top, then sprinkle remaining buckwheat over the veggies. Lastly drizzle dressing over and scatter a few lemon wedges on the side. Serve with meat if desired or just alone. Very delicious, the entire family went back for seconds!</step>
    </part>

    <part>
        <title>Dressing</title>
        <ingredient>1/4 cup olive oil</ingredient>
        <ingredient>1/4 cup tahini (Mayver brand)</ingredient>
        <ingredient>2 TBsp lemon juice</ingredient>
        <step>add all ingredients togetherand mix well (season if desired.)</step>
    </part>

</recipe>