<?xml version='1.0' encoding='UTF-8'?>
<?xml-stylesheet type='text/xsl' href='/xml/xsd2html2xml/xsd2html2xml.xsl'?>
<recipe xmlns="https://cazzscookingcommunity.github.io"
        xmlns:xsi="http://www.w3.org/2001/XMLSchema-instance"
        xsi:schemaLocation="https://cazzscookingcommunity.github.io /xml/recipe.xsd">
  <title>Cookie in a Cup</title>
  <filename>cookie_in_a_cup.xml</filename>
  <thumbnail>cookie _in_a_cup.jpeg</thumbnail>
  <category>Sweets</category>
  <ingredient>2 ceramic cups </ingredient>
  <ingredient>2 TBsp butter</ingredient>
  <ingredient>1 TBsp brown sugar </ingredient>
  <ingredient>1 TBsp sugar</ingredient>
  <ingredient>1/4 teaspoon vanilla</ingredient>
  <ingredient>1/4 teaspoon baking powder</ingredient>
  <ingredient>1/3 cup flour</ingredient>
  <ingredient>1 egg</ingredient>
  <ingredient>Pinch salt</ingredient>
  <step>
In a small jug melt butter for 30 seconds. Add sugars and vanilla stir. Beat egg and stir in, then add flour, baking soda and salt. Stir until lumps removed, then stir through chocolate chips. Pour equally between the two cups and cook individually for 30-40 seconds. Sprinkle over a few more chocolate chips and sprinkle a little cocoa. Serve immediately.
    </step>
</recipe>
